{
  "$schema": "https://guns-only.invalid/schemas/v1/playable-narrative-sequence.schema.json",
  "schemaVersion": "1.0.0",
  "sequenceId": "sequence.korea-1951.armstrong-cable-strike.v1",
  "status": "researching",
  "mode": "fixed_history",
  "title": "The Long Way Home: 3 September 1951",
  "logline": "A twenty-one-year-old naval aviator launches from USS Essex, strikes a cable during a low-level armed-reconnaissance run, and must hold a crippled Panther together long enough to reach friendly territory and eject.",
  "targetDurationMinutes": {
    "minimum": 16,
    "nominal": 22,
    "maximum": 30
  },
  "governance": {
    "governanceId": "governance.korea-braided.v1",
    "timelineId": "timeline.korea-1950s.v1",
    "dossierId": "dossier.armstrong-cable-strike.v1",
    "dossierPath": "content/governance/korea-braided/missions/armstrong-cable-strike.dossier.json",
    "claimRefs": [
      "claim.armstrong-vf51-essex.v1",
      "claim.armstrong-armed-recon-wonsan.v1",
      "claim.armstrong-cable-strike.v1",
      "claim.armstrong-wing-loss.v1",
      "claim.carpenter-flight-lead.v1",
      "claim.armstrong-no-landing-decision.v1",
      "claim.armstrong-ejection-friendly-territory.v1",
      "claim.panther-ejection-seat.v1",
      "claim.cable-field-gameplay-reconstruction.v1",
      "claim.panther-damage-flight-reconstruction.v1"
    ],
    "openResearchRefs": [
      "individual-airframe-configuration",
      "target-run-detail",
      "cable-layout",
      "loadout",
      "damaged-aerodynamics",
      "radio-transcript",
      "ejection-seat-model-and-envelope",
      "ejection-point",
      "parachute-equipment-wind-and-path",
      "ground-recovery"
    ]
  },
  "authoredInvariants": [
    "Armstrong launches from USS Essex as a VF-51 Panther pilot on an armed-reconnaissance sortie.",
    "Major John Carpenter leads the flight.",
    "The required low-level attack route intersects physical cable geometry.",
    "Cable contact removes a substantial portion of the right wing and creates persistent asymmetric flight.",
    "Armstrong and Carpenter determine that slowing for a landing is unsafe.",
    "Armstrong carries the aircraft south into friendly territory before ejecting.",
    "The ejection, parachute descent and ground recovery complete the playable sequence.",
    "No mission dialogue foreshadows Apollo, the Moon or Armstrong's later fame."
  ],
  "playerAgency": {
    "owns": [
      "Deck and launch checks that are exposed as controls.",
      "Formation position, route discipline, attack-run control and terrain clearance.",
      "Immediate control response after the cable strike.",
      "Airspeed, roll, yaw, altitude and engine management in the damaged aircraft.",
      "Execution of the ejection preparation and ejection action.",
      "The quality of the flight as recorded for replay and debrief."
    ],
    "doesNotOwn": [
      "Whether the historical cable strike occurs.",
      "Whether the damaged Panther is judged unsafe to land.",
      "Whether the story becomes a counterfactual biography.",
      "The documented identities of Armstrong, Carpenter, VF-51 or USS Essex.",
      "Dialogue, camera, damage or recovery facts not supported by simulation events."
    ],
    "plotBreakingDivergence": [
      "Abandoning or bypassing the required attack corridor.",
      "Missing the authored cable contact after entering its terminal approach gate.",
      "Crashing before the damaged-flight beat can advance.",
      "Leaving the damaged-flight route or ejecting before the friendly-territory gate.",
      "Failing an ejection action in a way that would replace the documented recovery with an alternate death."
    ],
    "retryPolicy": "Restore the nearest completed narrative checkpoint with identical mission seed, authored conditions and disclosed reconstruction status; do not canonize the failed attempt as an alternate historical outcome."
  },
  "cast": [
    {
      "characterId": "character.neil-armstrong-1951.v1",
      "kind": "historical_person",
      "displayName": "Ensign Neil A. Armstrong",
      "operationalRole": "VF-51 F9F-2 Panther pilot and player character",
      "dramaticFunction": "Make the story emerge from a young pilot's technical attention, aircraft handling and procedural composure rather than retrospective hero narration.",
      "knowledgeBoundary": "He knows only what he can see, feel in the controls, hear over the radio or infer from the Panther's instruments and Carpenter's inspection.",
      "dialoguePolicy": "Use sourced words when available and otherwise only restrained procedural reconstruction; never invent private thought, political exposition, moral instruction or Moon foreshadowing.",
      "voicePolicy": "Use an original disclosed synthetic performance appropriate to a young Midwestern U.S. naval aviator; never clone, match or instruct the model to imitate Neil Armstrong's recorded voice.",
      "claimRefs": [
        "claim.armstrong-vf51-essex.v1",
        "claim.armstrong-cable-strike.v1",
        "claim.armstrong-wing-loss.v1",
        "claim.armstrong-ejection-friendly-territory.v1"
      ]
    },
    {
      "characterId": "character.john-carpenter-korea.v1",
      "kind": "historical_person",
      "displayName": "Major John Carpenter",
      "operationalRole": "USAF exchange officer and flight lead",
      "dramaticFunction": "Provide the external damage inspection and professional second judgment that turns a damaged-flight problem into the decision to eject.",
      "knowledgeBoundary": "He can report what is visible from formation and what the flight's radio exchange establishes; he does not know hidden airframe state.",
      "dialoguePolicy": "No quotation is locked until supported by a transcript, oral history or clearly declared procedural reconstruction.",
      "voicePolicy": "Use an original disclosed synthetic performance for a mature U.S. military pilot; do not imitate a real recording or use celebrity resemblance as direction.",
      "claimRefs": [
        "claim.carpenter-flight-lead.v1",
        "claim.armstrong-no-landing-decision.v1"
      ]
    },
    {
      "characterId": "role.essex-flight-deck.v1",
      "kind": "documented_operational_role",
      "displayName": "Essex flight deck",
      "operationalRole": "Plane handlers, launch crew and flight-deck control",
      "dramaticFunction": "Establish that the sortie begins inside a practiced human machine before narrowing to two aircraft over the target.",
      "knowledgeBoundary": "The role knows deck state, launch state and visible aircraft condition only.",
      "dialoguePolicy": "Prefer hand signals, machinery and period procedure; add named or spoken lines only after cruise records or procedure sources support them.",
      "voicePolicy": "Operational voices are original performances and remain unnamed until the historical record identifies a speaker.",
      "claimRefs": [
        "claim.armstrong-vf51-essex.v1"
      ]
    },
    {
      "characterId": "role.friendly-ground-recovery.v1",
      "kind": "documented_operational_role",
      "displayName": "Friendly ground recovery",
      "operationalRole": "Personnel who recover Armstrong after descent",
      "dramaticFunction": "Return the story from machinery and sky to an ordinary human-scale ending.",
      "knowledgeBoundary": "The role knows only the visible descent, landing and local recovery conditions.",
      "dialoguePolicy": "Armstrong's retrospective account identifies Goodell Warren and a jeep near Pohang/K-3; do not invent words, exact location, vehicle appearance or interaction while independent corroboration remains open.",
      "voicePolicy": "No voice is cast until the ground-recovery source gap is resolved.",
      "claimRefs": [
        "claim.armstrong-ejection-friendly-territory.v1"
      ]
    }
  ],
  "referenceIndex": {
    "worldFacts": [
      "fact.armed-recon-target.v1",
      "fact.armstrong-sortie-complete.v1",
      "fact.attack-run-route.v1",
      "fact.authored-low-level-route.v1",
      "fact.carpenter-inspection-geometry.v1",
      "fact.carpenter-lead-aircraft.v1",
      "fact.ejection-recorded.v1",
      "fact.civilian-scenery-nontargetable.v1",
      "fact.ejection-disposal-corridor.v1",
      "fact.friendly-ground-recovery.v1",
      "fact.friendly-landing-area-reconstruction.v1",
      "fact.friendly-territory-boundary.v1",
      "fact.korea-coast-route.v1",
      "fact.majon-ni-valley-terrain.v1",
      "fact.panther-asymmetric-lift.v1",
      "fact.panther-ejection-checklist.v1",
      "fact.panther-ejection-envelope.v1",
      "fact.panther-landing-speed-risk.v1",
      "fact.panther-launch-ready.v1",
      "fact.panther-reduced-roll-authority.v1",
      "fact.panther-right-wing-damage.v1",
      "fact.parachute-deployment.v1",
      "fact.parachute-descent-reconstruction.v1",
      "fact.physical-cable-collision.v1",
      "fact.pilot-seat-separation.v1",
      "fact.player-on-essex-catapult.v1",
      "fact.southbound-route.v1"
    ],
    "events": [
      "event.narrative.armstrong-sortie-complete.v1",
      "event.narrative.attack-run-complete.v1",
      "event.narrative.cable-contact.v1",
      "event.narrative.cable-corridor-entered.v1",
      "event.narrative.damage-inspection-complete.v1",
      "event.narrative.damaged-flight-stabilized.v1",
      "event.narrative.deck-launch-complete.v1",
      "event.narrative.ejection-decision.v1",
      "event.narrative.ejection-initiated.v1",
      "event.narrative.ejection-ready.v1",
      "event.narrative.friendly-territory-entered.v1",
      "event.narrative.korea-coast-crossed.v1",
      "event.narrative.parachute-deployed.v1",
      "event.narrative.pilot-ground-contact.v1",
      "event.narrative.right-wing-damaged.v1",
      "event.narrative.target-area-entered.v1"
    ],
    "mechanics": [
      "mechanic.airframe-impulse.v1",
      "mechanic.carrier-catapult.v1",